{
  "schema_version": 1,
  "generated_at": "2026-08-30T18:07:09-03:00",
  "city": "Ciudad Autónoma de Buenos Aires",
  "license": "Datos públicos recopilados de agendas oficiales. Uso informativo.",
  "events": [
    {
      "id": "museo-nacional-bellas-artes-paseo-de-las-esculturas-2026-08-30",
      "title": "Paseo de las Esculturas",
      "description": "Espacio parquizado al aire libre de 2.000 m² con esculturas, en el Museo Nacional de Bellas Artes.",
      "category": "ARTES_VISUALES",
      "tags": [
        "aire-libre",
        "escultura"
      ],
      "date": "2026-08-30",
      "start_time": "09:00",
      "end_time": "19:00",
      "all_day": false,
      "access_mode": "INGRESO_LIBRE",
      "reservation_url": null,
      "venue": {
        "id": "museo-nacional-bellas-artes",
        "name": "Museo Nacional de Bellas Artes",
        "address": "Av. del Libertador 1473",
        "neighborhood": "Recoleta",
        "commune": 2,
        "lat": -34.5838,
        "lon": -58.3919
      },
      "source_name": "Argentina.gob.ar",
      "source_url": "https://www.argentina.gob.ar/noticias/agenda-de-cultura-para-el-fin-de-semana-97",
      "image_url": null,
      "updated_at": "2026-08-30T06:00:00-03:00"
    },
    {
      "id": "mnba-paseo-esculturas-2026-08-30",
      "title": "Paseo de las Esculturas",
      "description": "Espacio parquizado al aire libre de 2.000 m² con esculturas, en el Museo Nacional de Bellas Artes.",
      "category": "ARTES_VISUALES",
      "tags": [
        "aire-libre",
        "escultura"
      ],
      "date": "2026-08-30",
      "start_time": "09:00",
      "end_time": "19:00",
      "all_day": false,
      "access_mode": "INGRESO_LIBRE",
      "reservation_url": null,
      "venue": {
        "id": "museo-nacional-bellas-artes",
        "name": "Museo Nacional de Bellas Artes",
        "address": "Av. del Libertador 1473",
        "neighborhood": "Recoleta",
        "commune": 2,
        "lat": -34.5838,
        "lon": -58.3919
      },
      "source_name": "Argentina.gob.ar",
      "source_url": "https://www.argentina.gob.ar/noticias/agenda-de-cultura-para-el-fin-de-semana-97",
      "image_url": null,
      "updated_at": "2026-08-30T06:00:00-03:00"
    },
    {
      "id": "museo-del-cabildo-celeste-bandera-nora-iniesta-y-exodo-jujeno-2026-08-30",
      "title": "Celeste Bandera (Nora Iniesta) y Éxodo Jujeño",
      "description": "Muestra «Celeste Bandera» de Nora Iniesta junto al ciclo pictórico «Éxodo jujeño, Belgrano y sus hazañas» de Andrea Avagnina.",
      "category": "ARTES_VISUALES",
      "tags": [
        "muestra",
        "historia"
      ],
      "date": "2026-08-30",
      "start_time": "10:30",
      "end_time": "18:00",
      "all_day": false,
      "access_mode": "INGRESO_LIBRE",
      "reservation_url": null,
      "venue": {
        "id": "museo-del-cabildo",
        "name": "Museo Histórico Nacional del Cabildo",
        "address": "Bolívar 65",
        "neighborhood": "Monserrat",
        "commune": 1,
        "lat": -34.6086,
        "lon": -58.373
      },
      "source_name": "Argentina.gob.ar",
      "source_url": "https://www.argentina.gob.ar/noticias/agenda-de-cultura-para-el-fin-de-semana-97",
      "image_url": null,
      "updated_at": "2026-08-30T06:00:00-03:00"
    },
    {
      "id": "cabildo-celeste-bandera-exodo-2026-08-30",
      "title": "Celeste Bandera (Nora Iniesta) y Éxodo Jujeño",
      "description": "Muestra «Celeste Bandera» de Nora Iniesta junto al ciclo pictórico «Éxodo jujeño, Belgrano y sus hazañas» de Andrea Avagnina.",
      "category": "ARTES_VISUALES",
      "tags": [
        "muestra",
        "historia"
      ],
      "date": "2026-08-30",
      "start_time": "10:30",
      "end_time": "18:00",
      "all_day": false,
      "access_mode": "INGRESO_LIBRE",
      "reservation_url": null,
      "venue": {
        "id": "museo-del-cabildo",
        "name": "Museo Histórico Nacional del Cabildo",
        "address": "Bolívar 65",
        "neighborhood": "Monserrat",
        "commune": 1,
        "lat": -34.6086,
        "lon": -58.373
      },
      "source_name": "Argentina.gob.ar",
      "source_url": "https://www.argentina.gob.ar/noticias/agenda-de-cultura-para-el-fin-de-semana-97",
      "image_url": null,
      "updated_at": "2026-08-30T06:00:00-03:00"
    },
    {
      "id": "feria-de-mataderos-feria-tradicional-de-mataderos-2026-08-30",
      "title": "Feria Tradicional de Mataderos",
      "description": "Puestos de artesanías criollas, destrezas gauchas y música folklórica en vivo.",
      "category": "FERIAS",
      "tags": [
        "folklore",
        "aire-libre",
        "artesanias"
      ],
      "date": "2026-08-30",
      "start_time": "11:00",
      "end_time": null,
      "all_day": false,
      "access_mode": "INGRESO_LIBRE",
      "reservation_url": null,
      "venue": {
        "id": "feria-de-mataderos",
        "name": "Feria de Mataderos",
        "address": "Av. de los Corrales y Lisandro de la Torre",
        "neighborhood": "Mataderos",
        "commune": 9,
        "lat": -34.658,
        "lon": -58.503
      },
      "source_name": "Turismo Buenos Aires",
      "source_url": "https://turismo.buenosaires.gob.ar/es/eventos",
      "image_url": null,
      "updated_at": "2026-08-30T06:00:00-03:00"
    },
    {
      "id": "feria-mataderos-2026-08-30",
      "title": "Feria Tradicional de Mataderos",
      "description": "Puestos de artesanías criollas, destrezas gauchas y música folklórica en vivo.",
      "category": "FERIAS",
      "tags": [
        "folklore",
        "aire-libre",
        "artesanias"
      ],
      "date": "2026-08-30",
      "start_time": "11:00",
      "end_time": null,
      "all_day": false,
      "access_mode": "INGRESO_LIBRE",
      "reservation_url": null,
      "venue": {
        "id": "feria-de-mataderos",
        "name": "Feria de Mataderos",
        "address": "Av. de los Corrales y Lisandro de la Torre",
        "neighborhood": "Mataderos",
        "commune": 9,
        "lat": -34.658,
        "lon": -58.503
      },
      "source_name": "Turismo Buenos Aires",
      "source_url": "https://turismo.buenosaires.gob.ar/es/eventos",
      "image_url": null,
      "updated_at": "2026-08-30T06:00:00-03:00"
    },
    {
      "id": "usina-camara-seibert-campos-herrera-2026-08-30",
      "title": "Ciclo Música de Cámara: Trío Seibert · Campos · Herrera",
      "description": "Recital de cámara con obras de Clara Wieck y Robert Schumann en la Sala de Cámara de la Usina del Arte.",
      "category": "MUSICA",
      "tags": [
        "clasica",
        "camara"
      ],
      "date": "2026-08-30",
      "start_time": "11:30",
      "end_time": null,
      "all_day": false,
      "access_mode": "ORDEN_DE_LLEGADA",
      "reservation_url": null,
      "venue": {
        "id": "usina-del-arte",
        "name": "Usina del Arte · Sala de Cámara",
        "address": "Caffarena 1",
        "neighborhood": "La Boca",
        "commune": 4,
        "lat": -34.639,
        "lon": -58.3576
      },
      "source_name": "Usina del Arte",
      "source_url": "https://usinadelarte.ar/actividades/",
      "image_url": null,
      "updated_at": "2026-08-30T06:00:00-03:00"
    },
    {
      "id": "plaza-seeber-rosh-hashana-2026-08-30",
      "title": "Celebración de Rosh Hashaná 5787",
      "description": "Encuentro intercultural al aire libre con 17 puestos de gastronomía tradicional, 19 stands de artesanías, cinco espectáculos musicales en vivo y talleres de cocina y danza.",
      "category": "FERIAS",
      "tags": [
        "colectividades",
        "aire-libre",
        "gastronomia"
      ],
      "date": "2026-08-30",
      "start_time": "12:00",
      "end_time": "18:00",
      "all_day": false,
      "access_mode": "INGRESO_LIBRE",
      "reservation_url": null,
      "venue": {
        "id": "plaza-seeber",
        "name": "Plaza Seeber",
        "address": "Av. Casares y Av. Sarmiento",
        "neighborhood": "Palermo",
        "commune": 14,
        "lat": -34.5776,
        "lon": -58.4108
      },
      "source_name": "Turismo Buenos Aires",
      "source_url": "https://turismo.buenosaires.gob.ar/es/eventos",
      "image_url": null,
      "updated_at": "2026-08-30T06:00:00-03:00"
    },
    {
      "id": "usina-semifinal-tango-escenario-2026-08-30",
      "title": "Semifinal de Tango Escenario (Mundial de Tango)",
      "description": "Semifinal de la categoría Tango Escenario del Tango BA Festival y Mundial, con parejas clasificadas de instancias nacionales e internacionales.",
      "category": "MUSICA",
      "tags": [
        "tango",
        "festival",
        "danza"
      ],
      "date": "2026-08-30",
      "start_time": "12:00",
      "end_time": null,
      "all_day": false,
      "access_mode": "RESERVA_PREVIA",
      "reservation_url": "https://tangoba.org/festival-mundial/actividades-del-mundial/",
      "venue": {
        "id": "usina-del-arte",
        "name": "Usina del Arte",
        "address": "Caffarena 1",
        "neighborhood": "La Boca",
        "commune": 4,
        "lat": -34.639,
        "lon": -58.3576
      },
      "source_name": "Tango BA",
      "source_url": "https://tangoba.org/festival-mundial/actividades-del-mundial/",
      "image_url": null,
      "updated_at": "2026-08-30T06:00:00-03:00"
    },
    {
      "id": "centro-cultural-recoleta-exhibiciones-klemm-valcarcel-medina-el-juguete-rabioso-2026-08-30",
      "title": "Exhibiciones: Klemm, Valcárcel Medina, El juguete rabioso",
      "description": "Grilla expositiva del Centro Cultural Recoleta: «Federico Klemm. Iluminador de mitos», «Isidoro Valcárcel Medina: El transcurrir», «El juguete rabioso: 100 años», «Fantasía de valor», «Plástica escatológica» e «Hijos de la Luna».",
      "category": "ARTES_VISUALES",
      "tags": [
        "muestra",
        "museo"
      ],
      "date": "2026-08-30",
      "start_time": "13:00",
      "end_time": "19:00",